{
  "schemaVersion": "OwlCodaRunKitOwnerDeploymentDecisionV1",
  "decisionId": "replace-with-owner-decision-id",
  "decisionVersion": 1,
  "provenance": {
    "kind": "owner_explicit",
    "sourceRef": "replace-with-owner-controlled-source-ref",
    "recordedAt": "2026-08-01T00:00:00.000Z"
  },
  "project": {
    "projectId": "replace-with-project-id",
    "scope": "replace-with-deployment-scope"
  },
  "supersedesDecisionSha256": null,
  "deploymentMode": "clean_install",
  "existingProjectAssets": "replace",
  "legacyRollbackAllowed": false,
  "dataAuthority": {
    "mode": "initialize_new",
    "sourceRef": "replace-with-owner-controlled-data-authority-ref"
  },
  "serviceActivationAuthorized": false,
  "baselineCutAuthorized": false,
  "destructiveScope": [],
  "decisionSha256": "aaaaaaaaaaaaaaaaaaaaaaaaaaaaaaaaaaaaaaaaaaaaaaaaaaaaaaaaaaaaaaaa"
}
